<?xml version="1.0" encoding="UTF-8"?>
<dataroot xmlns:od="urn:schemas-microsoft-com:officedata" xmlns:xsi="http://www.w3.org/2001/XMLSchema-instance"  xsi:noNamespaceSchemaLocation="40_Scales.xsd" generated="2025-09-22T19:06:01">
<_x0034_0_Scales>
<ScaleID>1</ScaleID>
<ScaleName>Social Phobia (9.1)</ScaleName>
<ScaleConstruct>Social Anxiety</ScaleConstruct>
<ScaleUpperConstruct>Anxiety</ScaleUpperConstruct>
<ItemN>9</ItemN>
<ScaleShortName>Social Phobia</ScaleShortName>
<ScaleInitials>SP</ScaleInitials>
<InstrumentCollection>1</InstrumentCollection>
<InstrumentLength>47</InstrumentLength>
</_x0034_0_Scales>
<_x0034_0_Scales>
<ScaleID>2</ScaleID>
<ScaleName>Panic Disorder (9.1)</ScaleName>
<ScaleConstruct>Panic</ScaleConstruct>
<ScaleUpperConstruct>Anxiety</ScaleUpperConstruct>
<ItemN>9</ItemN>
<ScaleShortName>Panic Disorder</ScaleShortName>
<ScaleInitials>PD</ScaleInitials>
<InstrumentCollection>1</InstrumentCollection>
<InstrumentLength>47</InstrumentLength>
</_x0034_0_Scales>
<_x0034_0_Scales>
<ScaleID>3</ScaleID>
<ScaleName>Generalized Anxiety Disorder (6.1)</ScaleName>
<ScaleConstruct>Worry</ScaleConstruct>
<ScaleUpperConstruct>Anxiety</ScaleUpperConstruct>
<ItemN>6</ItemN>
<ScaleShortName>Generalized Anxiety Disorder</ScaleShortName>
<ScaleInitials>GAD</ScaleInitials>
<InstrumentCollection>1</InstrumentCollection>
<InstrumentLength>47</InstrumentLength>
</_x0034_0_Scales>
<_x0034_0_Scales>
<ScaleID>4</ScaleID>
<ScaleName>Major Depressive Disorder (10.1)</ScaleName>
<ScaleConstruct>Depressed Mood</ScaleConstruct>
<ScaleUpperConstruct>Depression</ScaleUpperConstruct>
<ItemN>10</ItemN>
<ScaleShortName>Major Depressive Disorder</ScaleShortName>
<ScaleInitials>MDD</ScaleInitials>
<InstrumentCollection>1</InstrumentCollection>
<InstrumentLength>25</InstrumentLength>
</_x0034_0_Scales>
<_x0034_0_Scales>
<ScaleID>5</ScaleID>
<ScaleName>Separation Anxiety Disorder (7.1)</ScaleName>
<ScaleConstruct>Separation Anxiety</ScaleConstruct>
<ScaleUpperConstruct>Anxiety</ScaleUpperConstruct>
<ItemN>7</ItemN>
<ScaleShortName>Separation Anxiety Disorder</ScaleShortName>
<ScaleInitials>SAD</ScaleInitials>
<InstrumentCollection>1</InstrumentCollection>
<InstrumentLength>47</InstrumentLength>
</_x0034_0_Scales>
<_x0034_0_Scales>
<ScaleID>6</ScaleID>
<ScaleName>Obsessive Compulsive Disorder (6.1)</ScaleName>
<ScaleConstruct>OCD</ScaleConstruct>
<ScaleUpperConstruct>Anxiety</ScaleUpperConstruct>
<ItemN>6</ItemN>
<ScaleShortName>Obsessive Compulsive Disorder</ScaleShortName>
<ScaleInitials>OCD</ScaleInitials>
<InstrumentCollection>1</InstrumentCollection>
<InstrumentLength>47</InstrumentLength>
</_x0034_0_Scales>
<_x0034_0_Scales>
<ScaleID>7</ScaleID>
<ScaleName>Total Anxiety (37.1)</ScaleName>
<ScaleConstruct>Anxiety</ScaleConstruct>
<ScaleUpperConstruct>Anxiety</ScaleUpperConstruct>
<ItemN>37</ItemN>
<ScaleShortName>Total Anxiety (37.1)</ScaleShortName>
<ScaleInitials>ANX</ScaleInitials>
<InstrumentCollection>1</InstrumentCollection>
<InstrumentLength>47</InstrumentLength>
</_x0034_0_Scales>
<_x0034_0_Scales>
<ScaleID>8</ScaleID>
<ScaleName>Total Anxiety and Depression (47.1)</ScaleName>
<ScaleConstruct>Negative Affect</ScaleConstruct>
<ScaleUpperConstruct>Negative Affect</ScaleUpperConstruct>
<ItemN>47</ItemN>
<ScaleShortName>Total Anxiety and Depression (47.1)</ScaleShortName>
<ScaleInitials>ANXDEP</ScaleInitials>
<InstrumentCollection>1</InstrumentCollection>
<InstrumentLength>47</InstrumentLength>
</_x0034_0_Scales>
<_x0034_0_Scales>
<ScaleID>9</ScaleID>
<ScaleName>Total Anxiety (15.1)</ScaleName>
<ScaleConstruct>Anxiety</ScaleConstruct>
<ScaleUpperConstruct>Anxiety</ScaleUpperConstruct>
<ItemN>15</ItemN>
<ScaleShortName>Total Anxiety (15.1)</ScaleShortName>
<ScaleInitials>Anx15</ScaleInitials>
<InstrumentCollection>1</InstrumentCollection>
<InstrumentLength>25</InstrumentLength>
</_x0034_0_Scales>
<_x0034_0_Scales>
<ScaleID>10</ScaleID>
<ScaleName>Total Anxiety and Depression (25.1)</ScaleName>
<ScaleConstruct>Negative Affect</ScaleConstruct>
<ScaleUpperConstruct>Negative Affect</ScaleUpperConstruct>
<ItemN>25</ItemN>
<ScaleShortName>Total Anxiety and Depression (25.1)</ScaleShortName>
<ScaleInitials>AnxDep25</ScaleInitials>
<InstrumentCollection>1</InstrumentCollection>
<InstrumentLength>25</InstrumentLength>
</_x0034_0_Scales>
<_x0034_0_Scales>
<ScaleID>11</ScaleID>
<ScaleName>Total Depression (5.1)</ScaleName>
<ScaleConstruct>Depression</ScaleConstruct>
<ScaleUpperConstruct>Depression</ScaleUpperConstruct>
<ItemN>5</ItemN>
<ScaleShortName>Total Depression (5.1)</ScaleShortName>
<ScaleInitials>Dep5</ScaleInitials>
<InstrumentCollection>1</InstrumentCollection>
</_x0034_0_Scales>
<_x0034_0_Scales>
<ScaleID>12</ScaleID>
<ScaleName>Total Anxiety (20.1)</ScaleName>
<ScaleConstruct>Anxiety</ScaleConstruct>
<ScaleUpperConstruct>Anxiety</ScaleUpperConstruct>
<ItemN>20</ItemN>
<ScaleShortName>Total Anxiety (20.1)</ScaleShortName>
<ScaleInitials>Anx20</ScaleInitials>
<InstrumentCollection>1</InstrumentCollection>
</_x0034_0_Scales>
<_x0034_0_Scales>
<ScaleID>13</ScaleID>
<ScaleName>Relationship (7.1)</ScaleName>
<ScaleConstruct>Relationship</ScaleConstruct>
<ScaleUpperConstruct>Engagement</ScaleUpperConstruct>
<ItemN>7</ItemN>
<ScaleShortName>Relationship</ScaleShortName>
<ScaleInitials>R</ScaleInitials>
<InstrumentCollection>3</InstrumentCollection>
<InstrumentLength>35</InstrumentLength>
</_x0034_0_Scales>
<_x0034_0_Scales>
<ScaleID>14</ScaleID>
<ScaleName>Expectancy (7.1)</ScaleName>
<ScaleConstruct>Expectancy</ScaleConstruct>
<ScaleUpperConstruct>Engagement</ScaleUpperConstruct>
<ItemN>7</ItemN>
<ScaleShortName>Expectancy</ScaleShortName>
<ScaleInitials>E</ScaleInitials>
<InstrumentCollection>3</InstrumentCollection>
<InstrumentLength>35</InstrumentLength>
</_x0034_0_Scales>
<_x0034_0_Scales>
<ScaleID>15</ScaleID>
<ScaleName>Attendance (7.1)</ScaleName>
<ScaleConstruct>Attendance</ScaleConstruct>
<ScaleUpperConstruct>Engagement</ScaleUpperConstruct>
<ItemN>7</ItemN>
<ScaleShortName>Attendance</ScaleShortName>
<ScaleInitials>A</ScaleInitials>
<InstrumentCollection>3</InstrumentCollection>
<InstrumentLength>35</InstrumentLength>
</_x0034_0_Scales>
<_x0034_0_Scales>
<ScaleID>16</ScaleID>
<ScaleName>Clarity (7.1)</ScaleName>
<ScaleConstruct>Clarity</ScaleConstruct>
<ScaleUpperConstruct>Engagement</ScaleUpperConstruct>
<ItemN>7</ItemN>
<ScaleShortName>Clarity</ScaleShortName>
<ScaleInitials>C</ScaleInitials>
<InstrumentCollection>3</InstrumentCollection>
<InstrumentLength>35</InstrumentLength>
</_x0034_0_Scales>
<_x0034_0_Scales>
<ScaleID>17</ScaleID>
<ScaleName>Homework (7.1)</ScaleName>
<ScaleConstruct>Homework</ScaleConstruct>
<ScaleUpperConstruct>Engagement</ScaleUpperConstruct>
<ItemN>7</ItemN>
<ScaleShortName>Homework</ScaleShortName>
<ScaleInitials>H</ScaleInitials>
<InstrumentCollection>3</InstrumentCollection>
<InstrumentLength>35</InstrumentLength>
</_x0034_0_Scales>
<_x0034_0_Scales>
<ScaleID>18</ScaleID>
<ScaleName>Depression (9.1)</ScaleName>
<ScaleConstruct>Depression</ScaleConstruct>
<ScaleUpperConstruct>Negative Affect</ScaleUpperConstruct>
<ItemN>9</ItemN>
<ScaleShortName>Depression (9.1)</ScaleShortName>
<ScaleInitials>PHQ-9-Dep</ScaleInitials>
<InstrumentCollection>4</InstrumentCollection>
<InstrumentLength>9</InstrumentLength>
</_x0034_0_Scales>
</dataroot>
